{
  "schemaVersion": "1.0.0",
  "datasetId": "nordhold-build-23261523",
  "game": {
    "steamAppId": "3028310",
    "buildId": "23261523",
    "unityVersion": "2023.1.22f1"
  },
  "extraction": {
    "extractor": ".agents/skills/nordhold-game-data/scripts/extract_game_data.py",
    "extractorVersion": "1.0.0",
    "pythonVersion": "3.13.5",
    "dependencies": {
      "TypeTreeGeneratorAPI": "0.0.10",
      "UnityPy": "1.25.3"
    },
    "generatedAt": "2026-09-08T16:53:40.366Z",
    "parseErrors": [],
    "uncertainties": []
  },
  "records": [
    {
      "id": "banner-barbed-arrows-source",
      "entityType": "banner",
      "entityId": "barbed-arrows",
      "evidence": "direct-record",
      "sources": [
        {
          "sourceAsset": "NordHold_Data/resources.assets",
          "objectPathId": "13350",
          "internalKey": "CripplingShotRogueData"
        }
      ],
      "localizationLanguages": [
        "en",
        "de"
      ],
      "notes": []
    },
    {
      "id": "banner-barrier-bane-source",
      "entityType": "banner",
      "entityId": "barrier-bane",
      "evidence": "direct-record",
      "sources": [
        {
          "sourceAsset": "NordHold_Data/resources.assets",
          "objectPathId": "13398",
          "internalKey": "BarrierBaneData"
        }
      ],
      "localizationLanguages": [
        "en",
        "de"
      ],
      "notes": []
    },
    {
      "id": "banner-barrier-shatter-source",
      "entityType": "banner",
      "entityId": "barrier-shatter",
      "evidence": "direct-record",
      "sources": [
        {
          "sourceAsset": "NordHold_Data/resources.assets",
          "objectPathId": "13340",
          "internalKey": "BarrierBreakerData"
        }
      ],
      "localizationLanguages": [
        "en",
        "de"
      ],
      "notes": []
    },
    {
      "id": "banner-bloody-chain-source",
      "entityType": "banner",
      "entityId": "bloody-chain",
      "evidence": "direct-record",
      "sources": [
        {
          "sourceAsset": "NordHold_Data/resources.assets",
          "objectPathId": "13399",
          "internalKey": "BloodyChainData"
        }
      ],
      "localizationLanguages": [
        "en",
        "de"
      ],
      "notes": []
    },
    {
      "id": "banner-bodkin-arrow-source",
      "entityType": "banner",
      "entityId": "bodkin-arrow",
      "evidence": "direct-record",
      "sources": [
        {
          "sourceAsset": "NordHold_Data/resources.assets",
          "objectPathId": "13342",
          "internalKey": "BodkinArrowRogueData"
        }
      ],
      "localizationLanguages": [
        "en",
        "de"
      ],
      "notes": []
    },
    {
      "id": "banner-branding-source",
      "entityType": "banner",
      "entityId": "branding",
      "evidence": "direct-record",
      "sources": [
        {
          "sourceAsset": "NordHold_Data/resources.assets",
          "objectPathId": "13400",
          "internalKey": "BrandingData"
        }
      ],
      "localizationLanguages": [
        "en",
        "de"
      ],
      "notes": []
    },
    {
      "id": "banner-celestial-jumps-source",
      "entityType": "banner",
      "entityId": "celestial-jumps",
      "evidence": "direct-record",
      "sources": [
        {
          "sourceAsset": "NordHold_Data/resources.assets",
          "objectPathId": "13401",
          "internalKey": "CelestialJumpsData"
        }
      ],
      "localizationLanguages": [
        "en",
        "de"
      ],
      "notes": []
    },
    {
      "id": "banner-chain-crits-source",
      "entityType": "banner",
      "entityId": "chain-crits",
      "evidence": "direct-record",
      "sources": [
        {
          "sourceAsset": "NordHold_Data/resources.assets",
          "objectPathId": "13343",
          "internalKey": "ChainCritsRogueData"
        }
      ],
      "localizationLanguages": [
        "en",
        "de"
      ],
      "notes": []
    },
    {
      "id": "banner-chain-echo-source",
      "entityType": "banner",
      "entityId": "chain-echo",
      "evidence": "direct-record",
      "sources": [
        {
          "sourceAsset": "NordHold_Data/resources.assets",
          "objectPathId": "13358",
          "internalKey": "ExtendedChainRogueData"
        }
      ],
      "localizationLanguages": [
        "en",
        "de"
      ],
      "notes": []
    },
    {
      "id": "banner-chaos-bolts-source",
      "entityType": "banner",
      "entityId": "chaos-bolts",
      "evidence": "direct-record",
      "sources": [
        {
          "sourceAsset": "NordHold_Data/resources.assets",
          "objectPathId": "13402",
          "internalKey": "ChaosBoltsData"
        }
      ],
      "localizationLanguages": [
        "en",
        "de"
      ],
      "notes": []
    },
    {
      "id": "banner-chaos-storm-source",
      "entityType": "banner",
      "entityId": "chaos-storm",
      "evidence": "direct-record",
      "sources": [
        {
          "sourceAsset": "NordHold_Data/resources.assets",
          "objectPathId": "13344",
          "internalKey": "ChaosStormData"
        }
      ],
      "localizationLanguages": [
        "en",
        "de"
      ],
      "notes": []
    },
    {
      "id": "banner-charged-arrows-source",
      "entityType": "banner",
      "entityId": "charged-arrows",
      "evidence": "direct-record",
      "sources": [
        {
          "sourceAsset": "NordHold_Data/resources.assets",
          "objectPathId": "13403",
          "internalKey": "ChargedArrowsData"
        }
      ],
      "localizationLanguages": [
        "en",
        "de"
      ],
      "notes": []
    },
    {
      "id": "banner-chill-explosion-source",
      "entityType": "banner",
      "entityId": "chill-explosion",
      "evidence": "direct-record",
      "sources": [
        {
          "sourceAsset": "NordHold_Data/resources.assets",
          "objectPathId": "13345",
          "internalKey": "ChillExplosionRogueData"
        }
      ],
      "localizationLanguages": [
        "en",
        "de"
      ],
      "notes": []
    },
    {
      "id": "banner-clinking-mastery-source",
      "entityType": "banner",
      "entityId": "clinking-mastery",
      "evidence": "direct-record",
      "sources": [
        {
          "sourceAsset": "NordHold_Data/resources.assets",
          "objectPathId": "13404",
          "internalKey": "ClinkingMasteryData"
        }
      ],
      "localizationLanguages": [
        "en",
        "de"
      ],
      "notes": []
    },
    {
      "id": "banner-cold-snap-source",
      "entityType": "banner",
      "entityId": "cold-snap",
      "evidence": "direct-record",
      "sources": [
        {
          "sourceAsset": "NordHold_Data/resources.assets",
          "objectPathId": "13346",
          "internalKey": "ColdSnapRogueData"
        }
      ],
      "localizationLanguages": [
        "en",
        "de"
      ],
      "notes": []
    },
    {
      "id": "banner-collapse-source",
      "entityType": "banner",
      "entityId": "collapse",
      "evidence": "direct-record",
      "sources": [
        {
          "sourceAsset": "NordHold_Data/resources.assets",
          "objectPathId": "13347",
          "internalKey": "CollapseRogueData"
        }
      ],
      "localizationLanguages": [
        "en",
        "de"
      ],
      "notes": []
    },
    {
      "id": "banner-corpse-explosion-fusion-source",
      "entityType": "banner",
      "entityId": "corpse-explosion-fusion",
      "evidence": "direct-record",
      "sources": [
        {
          "sourceAsset": "NordHold_Data/resources.assets",
          "objectPathId": "13405",
          "internalKey": "CorpseExplosionRogueData"
        }
      ],
      "localizationLanguages": [
        "en",
        "de"
      ],
      "notes": []
    },
    {
      "id": "banner-corpse-explosion-tower-specific-source",
      "entityType": "banner",
      "entityId": "corpse-explosion-tower-specific",
      "evidence": "direct-record",
      "sources": [
        {
          "sourceAsset": "NordHold_Data/resources.assets",
          "objectPathId": "13348",
          "internalKey": "CorpseExplosionRogueData"
        }
      ],
      "localizationLanguages": [
        "en",
        "de"
      ],
      "notes": []
    },
    {
      "id": "banner-crescendo-blast-source",
      "entityType": "banner",
      "entityId": "crescendo-blast",
      "evidence": "direct-record",
      "sources": [
        {
          "sourceAsset": "NordHold_Data/resources.assets",
          "objectPathId": "13349",
          "internalKey": "CrescendoBlastData"
        }
      ],
      "localizationLanguages": [
        "en",
        "de"
      ],
      "notes": []
    },
    {
      "id": "banner-crimson-beak-source",
      "entityType": "banner",
      "entityId": "crimson-beak",
      "evidence": "direct-record",
      "sources": [
        {
          "sourceAsset": "NordHold_Data/resources.assets",
          "objectPathId": "13406",
          "internalKey": "CrimsonBeakData"
        }
      ],
      "localizationLanguages": [
        "en",
        "de"
      ],
      "notes": []
    },
    {
      "id": "banner-crippling-pain-source",
      "entityType": "banner",
      "entityId": "crippling-pain",
      "evidence": "direct-record",
      "sources": [
        {
          "sourceAsset": "NordHold_Data/resources.assets",
          "objectPathId": "13407",
          "internalKey": "CripplingPainData"
        }
      ],
      "localizationLanguages": [
        "en",
        "de"
      ],
      "notes": []
    },
    {
      "id": "banner-critical-bleed-source",
      "entityType": "banner",
      "entityId": "critical-bleed",
      "evidence": "direct-record",
      "sources": [
        {
          "sourceAsset": "NordHold_Data/resources.assets",
          "objectPathId": "13341",
          "internalKey": "BleedCritsData"
        }
      ],